asin,name,url
B0H4ZB5NQV,"boAt Airdopes ProClip w/Air Conduction Tech, Feather-Light Earbuds, Clip-On Desi",https://www.amazon.in/dp/B0H4ZB5NQV
B0D78XFN97,"pTron Bassbuds Astra in-Ear TWS Earbuds w/Stereo Sound, 34Hrs Playtime, Stereo C",https://www.amazon.in/dp/B0D78XFN97
B0CR7N9MD9,"Portronics Konnect X USB to Type C Cable with 3A Output, Fast Charging & Data Tr",https://www.amazon.in/dp/B0CR7N9MD9
B0G81V3VY4,"Samsung Galaxy M06 5G Mobile (Sage Green, 4GB RAM, 64GB Storage) | MediaTek Dime",https://www.amazon.in/dp/B0G81V3VY4
B0CG29HWSS,POPIO Military-Grade Gorilla Tempered Glass For iPhone 15 / iPhone 16 | 9H Hardn,https://www.amazon.in/dp/B0CG29HWSS
B09KH58JZR,Portronics Konnect L POR-1403 Fast Charging 3A Type-C Cable 1.2 Meter with Charg,https://www.amazon.in/dp/B09KH58JZR
B0DB269JKH,"Portronics Clamp M4 Car Phone Holder Stand with 360 Degree Rotation, Strong Grip",https://www.amazon.in/dp/B0DB269JKH
B0GQTSHLLR,"OnePlus Nord Buds 4 Pro TWS Earbuds, Upto 55dB Real-time ANC, Adaptive Mode, 12m",https://www.amazon.in/dp/B0GQTSHLLR
B0DDHM6D3L,"Portronics Conch Theta C in Ear Type C Wired Earphones with in Line HD Mic, Powe",https://www.amazon.in/dp/B0DDHM6D3L
B09G9W3WFL,"Fashnex Resistance Bands Set for Exercise, Stretching and Workout Toning Tube Ki",https://www.amazon.in/dp/B09G9W3WFL
B0D9629NJQ,"Fastrack Limitless Glide X 1.83"" Smart Watch with Ultra UV HD Display, SpO2, Hea",https://www.amazon.in/dp/B0D9629NJQ
B0D2R2MXXJ,"Samsung Original 25W USB Type-C Travel Adaptor Without Cable for Google Pixel, X",https://www.amazon.in/dp/B0D2R2MXXJ
B0DGLRPVB6,"Portronics Conch Theta A in Ear 3.5mm Wired Earphones with In Line HD Mic, Power",https://www.amazon.in/dp/B0DGLRPVB6
B0GHRJTG1H,SupCares Tempered Glass for Motorola Edge 70 (6.7 Inch) With Installation Kit | ,https://www.amazon.in/dp/B0GHRJTG1H
B0CJMGTMHS,"Nokia 105 Classic | Single SIM Keypad Phone with Built-in UPI Payments, Long-Las",https://www.amazon.in/dp/B0CJMGTMHS
B0FBR6HGXM,"realme Buds T200x True Wireless Earbuds with 12.4mm Dynamic Bass Drivers, 25 dB ",https://www.amazon.in/dp/B0FBR6HGXM
B0DH3J6LB9,"Portronics Bridge Y USB 3.0 to Type C OTG Adaptor, 10Gbps High Speed Data Transf",https://www.amazon.in/dp/B0DH3J6LB9
B09R24HMNW,"ZEBRONICS Bro 3.5Mm Wired in Ear Earphones, in-Line Mic, Deep Bass, 1.2M Strong ",https://www.amazon.in/dp/B09R24HMNW
B09ZPL5VYM,Ambrane Multipurpose Tabletop Mobile Stand | Adjustable Angle & Height| Universa,https://www.amazon.in/dp/B09ZPL5VYM
B09YJ475JC,Lifelong LLYM92 Yoga mat for Women & Men EVA Material 4mm Anti-Slip Mat for Work,https://www.amazon.in/dp/B09YJ475JC
B0FHKKK2LC,SLOVIC Professional Football for Kids [Size-5] | Hard Ground Foot-Ball | Ideal f,https://www.amazon.in/dp/B0FHKKK2LC
B0C2KFQDJQ,Protoner Pair of 1 kg Each PVC Dumbbells Set Blue,https://www.amazon.in/dp/B0C2KFQDJQ
B0F43VZ4H1,"Samsung Galaxy M56 5G Mobile (Light Green,8GB RAM,128GB Storage)| Segment Slimme",https://www.amazon.in/dp/B0F43VZ4H1
B0DYFB76QF,Amazon Brand - Symactive 20 Kg Adjustable Dumbbells Kit for Full Body Workout| P,https://www.amazon.in/dp/B0DYFB76QF
B0CKBND48X,Boldfit Pull Up Bars For Home Workout -Chin Up Bar Gym Accessories for Men Door ,https://www.amazon.in/dp/B0CKBND48X
B0DCNWN8NZ,Apple EarPods (USB-C) ​​​​​​​,https://www.amazon.in/dp/B0DCNWN8NZ
B098NS6PVG,"Ambrane Unbreakable 3A Fast Charging 1.5m Braided Type C Cable for Smartphones, ",https://www.amazon.in/dp/B098NS6PVG
B0FRN7PYN6,Boldfit Blaze Football Practise Foot Ball Training Match Football Size 5 Origina,https://www.amazon.in/dp/B0FRN7PYN6
B0CQ7V5MGQ,Yonex Badminton Racquet Astrox Attack 9 Turquoise Green G4 4U(80GMS-32LBS)(Made ,https://www.amazon.in/dp/B0CQ7V5MGQ
B0FBRGKXHG,"OnePlus Bullets Wireless Z3 in-Ear Neckband with 12.4mm Drivers, 3D Spatial Audi",https://www.amazon.in/dp/B0FBRGKXHG
