asin,name,url
B0C281C231,BonKaso Premium Steel Multipurpose Climb Easy Anti-Slip 5-Step Foldable Ladder w,https://www.amazon.in/dp/B0C281C231
B0BN1V4GYB,Boldfit Gym Gloves for Men Workout Unisex Hand Gloves for Gym for Men & Women wi,https://www.amazon.in/dp/B0BN1V4GYB
B006QHB9GK,L'Oréal Paris Casting Crème Gloss Hair Color With Glycolic Gloss Complex | 5X Gl,https://www.amazon.in/dp/B006QHB9GK
B0CHJ2Y7GD,"amazon basics Rubber Encased Hex Dumbbell Weight Set Of 2, 5 Kg,Black",https://www.amazon.in/dp/B0CHJ2Y7GD
B0972V53MM,Boldfit Foam Roller For Deep Tissue Massage High Density Foam Rollers Stick For ,https://www.amazon.in/dp/B0972V53MM
B0BJZ5QYFV,Boldfit Woolen Winter Cap for Women & Men in Winter for Thermal Wear Stylish Sof,https://www.amazon.in/dp/B0BJZ5QYFV
B0D941VNH5,"Flexnest Commercial Grade Adjustable And Foldable Gym Bench Incline,Decline & Fl",https://www.amazon.in/dp/B0D941VNH5
B0FCMZSB8K,Foxtale Vitamin C Super Glow Face Wash with Papaya enzyme | Reduces Tan | Boosts,https://www.amazon.in/dp/B0FCMZSB8K
B0932T482G,Liril Lime Bathing Bar | Feel the Citrus Burst of Freshness | Pack of 4 (4 x 125,https://www.amazon.in/dp/B0932T482G
B0C9MVCV9Z,MARS Matte Lip Liner | One Swipe Smooth Application | Long Lasting Lip Pencil (1,https://www.amazon.in/dp/B0C9MVCV9Z
B09VPM5RP4,"Chemist At Play Exfoliating Body Wash 236ml | Removes Tan, Fights Body Acne, Str",https://www.amazon.in/dp/B09VPM5RP4
B09W5PSTBP,Lifelong PVC Hex Dumbbells Pack of 2 (5kg*2) Black Color for Home Gym Equipment ,https://www.amazon.in/dp/B09W5PSTBP
B09YRC6FBC,"Chemist At Play UnderArm Roll On with 5% AHA, Lactic Acid & 1% Mandelic Acid|Pre",https://www.amazon.in/dp/B09YRC6FBC
B0FF53KJ6N,Plantex Ladder for Home 7 Steps/Foldable Ladder with Anti-Skid Wide Steps (30L x,https://www.amazon.in/dp/B0FF53KJ6N
B0FKNNQ6KY,Lifelong Fit Pro Spin Fitness Bike for Home | Exercise Bike for Cardio Workout w,https://www.amazon.in/dp/B0FKNNQ6KY
B0D6G1JFZ2,Pilgrim Australian Tea Tree Non-Drying Anti-Dandruff Shampoo 200 ml | Removes Da,https://www.amazon.in/dp/B0D6G1JFZ2
B0DSLP1VCM,"L’Oréal Paris Hyaluron Pure 72H Purifying Shampoo, For oily scalp & dry hair wit",https://www.amazon.in/dp/B0DSLP1VCM
B0FG8CJ2F7,Boldfit Wrist Band for Gym Workout Wrist Support for Gym Straps for Men Hand Ban,https://www.amazon.in/dp/B0FG8CJ2F7
B0B5LGN5YH,"Toy Imagine Ht-196 Electric Air Pump for Inflatable Swimming Pools, Air Beds & T",https://www.amazon.in/dp/B0B5LGN5YH
B0CW1N7QRT,WishCare Niacinamide Oil Balance Fluid Sunscreen SPF 50 PA++++ In-Vivo Tested | ,https://www.amazon.in/dp/B0CW1N7QRT
B07QWSNTVY,YONEX ZR 100 light Aluminium Strung Badminton Racket with Full Racket Cover (Red,https://www.amazon.in/dp/B07QWSNTVY
B0FDWWNT31,Portronics Eco Glow 2 Tactical Rechargeable Flashlight Torch for Car & Road Emer,https://www.amazon.in/dp/B0FDWWNT31
B0GMSB9HG9,"Urban Punk Baseball Cap for Men Original Adjustable Unisex Cap, Mens Caps Stylis",https://www.amazon.in/dp/B0GMSB9HG9
B0CP9NMV6P,Dettol Original Bathing Soap Bar with 12 HR protective shield (400gm) | Kills 99,https://www.amazon.in/dp/B0CP9NMV6P
B00ICIIXRE,"BLACK+DECKER KX1800-B1, 1800 W, Dual Temperature High Speed Corded Heat Gun for ",https://www.amazon.in/dp/B00ICIIXRE
B0B7599YRJ,Boldfit Yoga Mats For Women and Men Exercise For Home Workout Gym Anti Slip EVA ,https://www.amazon.in/dp/B0B7599YRJ
B01LZBVOMD,Gala - 151810 Scrubber with Long Handle (Multicolour),https://www.amazon.in/dp/B01LZBVOMD
B078T4KPBQ,"Rexona Coconut and Olive Oil Soap For Silky Smooth Skin(4 * 100g),Pack of 4",https://www.amazon.in/dp/B078T4KPBQ
B0FD817WFP,Lifelong Walking Pad Treadmill|3 HP Brushless Motor|2-Level Manual Incline|LED D,https://www.amazon.in/dp/B0FD817WFP
B0BVMQN7PZ,RANUR Silicone Self Adhesive Door Bottom Sealing Strip Guard For Home Door Prote,https://www.amazon.in/dp/B0BVMQN7PZ
