asin,name,url
B0DHRP6SJQ,Konex Waterproof Silicone Swimming Cap for Men & Women | Stretchable & Quick-Dry,https://www.amazon.in/dp/B0DHRP6SJQ
B0CQM3WGNV,"Dettol Cologne Fresh Bathing Soap Bar with 12hr Freshness and Germ Protection, 1",https://www.amazon.in/dp/B0CQM3WGNV
B01LNA2MQK,Dettol Liquid Handwash Refill - Original Hand Wash- 1350ml | Germ Defence Formul,https://www.amazon.in/dp/B01LNA2MQK
B07FTGXRH1,"Maybelline New York SuperStay Matte Ink Liquid Lipstick - Voyager 50, Highly pig",https://www.amazon.in/dp/B07FTGXRH1
B0CQ4FQ2T7,"Nivia Storm White Moulded Football with Ball Pump Football - Size: 5 (Pack of 1,",https://www.amazon.in/dp/B0CQ4FQ2T7
B09TR8TMVR,Boldfit Resistance Bands Mini Loop Set (Pack of 3) Hip Toning Exercise for Gym B,https://www.amazon.in/dp/B09TR8TMVR
B006QHB88O,"L'Oréal Paris Permanent Hair Colour, Radiant At-Home Hair Colour with up to 100%",https://www.amazon.in/dp/B006QHB88O
B0D9VVQD2S,Lifelong Dual Color TPE Material Yoga Mat for Women & Men|6mm Anti-Slip Yoga Mat,https://www.amazon.in/dp/B0D9VVQD2S
B0D6R39TXG,Boldfit Resistance Bands for Workout for Women Pilate Bands for Home Exercise Th,https://www.amazon.in/dp/B0D6R39TXG
B09W5LHL7G,Lifelong PVC Hex Fixed Dumbbells Pack of 2 (2kg*2) Black Color for Home Gym Equi,https://www.amazon.in/dp/B09W5LHL7G
B0DMNQGRDW,"Lifelong Adjustable Pull-Up Bar for Home Gym | No Screws Hanging Bar, Adjustable",https://www.amazon.in/dp/B0DMNQGRDW
B000LQUA6M,Simple Kind To Skin Refreshing Facial Wash 150 ml | 100% Soap-Free Facewash that,https://www.amazon.in/dp/B000LQUA6M
B0CQRKP56R,T TOPLINE 5KG To 60KG Weight Adjustable Hight Quality Hand Gripper for Men & Wom,https://www.amazon.in/dp/B0CQRKP56R
B08FW1GJ4F,L'Oreal Paris Extraordinary Oil Hair Serum Powered by Floral Oils for All Hair T,https://www.amazon.in/dp/B08FW1GJ4F
B0B6XQGXJW,"L'Oreal Paris Moisture Filling Shampoo, With Hyaluronic Acid, For Dry & Dehydrat",https://www.amazon.in/dp/B0B6XQGXJW
B0CKYTJNS7,Wiselife True Alignment Yoga Mat + Sleek Yoga Strap For Men And Women (Probalanc,https://www.amazon.in/dp/B0CKYTJNS7
B0G43WXXRC,"Boldfit Bicycle Pump - High Pressure Foot Air Pump for Cycles, Balloons, Footbal",https://www.amazon.in/dp/B0G43WXXRC
B0C6M3KHXV,"The Derma Co 1% Hyaluronic Sunscreen Aqua Gel SPF 50 PA++++ | Hydrating, Lightwe",https://www.amazon.in/dp/B0C6M3KHXV
B0CJTRKS3W,"XTRIM Microfibre Towel (Small), Towel for Bath, Towel for Gym, Spa, Swimming, Fa",https://www.amazon.in/dp/B0CJTRKS3W
B09S3F35C5,Strauss Bicycle Air Pump with Needle & Dual Valve | 30 CM Long | Portable Pump w,https://www.amazon.in/dp/B09S3F35C5
B0GG4W7N66,"Pebble Newly Launched Qore 2 Premium Metal Fitness Band | 45 Days Battery Life, ",https://www.amazon.in/dp/B0GG4W7N66
B01CCGW732,"Cetaphil Oily Skin Cleanser, Daily Face Wash for Oily, Acne prone Skin, Gentle F",https://www.amazon.in/dp/B01CCGW732
B008KH31QU,"L'Oreal Paris Shampoo, For Damaged And Weak Hair, With Pro-Keratin + Ceramide, T",https://www.amazon.in/dp/B008KH31QU
B0DX1H3GH4,Boldfit Swimming Goggles for Men & Women with Adjustable Strap Anti Fog Goggles ,https://www.amazon.in/dp/B0DX1H3GH4
B0DKJZX382,PulGos 15-in-1 Pushup Board for Men & Women | Foldable Gym Equipment for Home Wo,https://www.amazon.in/dp/B0DKJZX382
B0F6444T7P,"Foxtale Super Glow Detan Face Wash with Vitamin C & Papaya enzyme, Tan Removal, ",https://www.amazon.in/dp/B0F6444T7P
B0DCJYS6KG,Boldfit Pull Up Bars For Home Workout -Chin Up Bar Gym Accessories for Men Door ,https://www.amazon.in/dp/B0DCJYS6KG
B0DSLP1VCM,"L’Oréal Paris Hyaluron Pure 72H Purifying Shampoo, For oily scalp & dry hair wit",https://www.amazon.in/dp/B0DSLP1VCM
B09G9W3WFL,"Fashnex Resistance Bands Set for Exercise, Stretching and Workout Toning Tube Ki",https://www.amazon.in/dp/B09G9W3WFL
B09Z6TJP7Y,Pond's Super Light Gel Oil Free Face Moisturizer 200 g | With Cera-Hyamino for U,https://www.amazon.in/dp/B09Z6TJP7Y
